{
  "$schema": "http://json-schema.org/draft-07/schema#",
  "$id": "https://po-helper-org/poh-sprint-agents/sprint-business/business.schema.json",
  "title": "Бизнес-блок отчёта «ФАКТ | спринт»",
  "description": "Файл reports/sprint-business.json. Пишет ИИ-агент навыком sprint-business по фактам из общего снимка данных (тот же, что у отчёта PO): цели OBJ и KR эпиков — только из OKR/roadmap PO, Sprint Goal, формулировки строк «что сделано · след. шаг», изменения, демо, квартальные риски. business.py встраивает блок в sprint-business.html, только если dataHash команды совпал с её данными. Цифры отчёта здесь не хранятся.",
  "type": "object",
  "required": [
    "version",
    "generatedAt",
    "teams"
  ],
  "additionalProperties": false,
  "properties": {
    "version": {
      "const": 1
    },
    "generatedAt": {
      "type": "string",
      "pattern": "^\\d{4}-\\d{2}-\\d{2}T\\d{2}:\\d{2}",
      "description": "Когда агент написал инсайды, ISO 8601."
    },
    "author": {
      "type": "string",
      "minLength": 1,
      "description": "Кто писал: имя агента или роли. Показывается мелким шрифтом под разделом."
    },
    "jiraNative": {
      "type": "string",
      "pattern": "\\{key\\}",
      "description": "Адрес задачи в JIRA-native (виджет JIRA) с подстановкой {key}: ключи на слайдах дают выбор «JIRA — в браузере» / «JIRA-native — виджет». Нет — только JIRA в браузере."
    },
    "teams": {
      "type": "object",
      "description": "slug команды → её бизнес-блок.",
      "additionalProperties": {
        "$ref": "#/definitions/team"
      }
    }
  },
  "definitions": {
    "team": {
      "type": "object",
      "additionalProperties": false,
      "description": "Бизнес-блок для презентации «ФАКТ | спринт» (управляющий комитет, PO смежных департаментов, бизнес-заказчики). Колода верхнеуровневая: слайд = OBJ, строка = KR (эпик) со сводкой историй спринта, истории — в сайдбаре по клику. «Результат» и сводку страница считает из данных сама; здесь — цели, KR, Sprint Goal и короткие формулировки «итог · блокер · след. шаг» вместо автоматических.",
      "properties": {
        "dataHash": {
          "type": "string",
          "pattern": "^[0-9a-f]{64}$",
          "description": "Хеш данных команды из `business.py facts`: блок привязан к сбору; данные пересобрали — хеш другой, и страница блок не покажет."
        },
        "objectives": {
          "type": "object",
          "additionalProperties": {
            "type": "string",
            "minLength": 3,
            "description": "Название цели, до 100 знаков."
          },
          "description": "Код цели → её название: «OBJ 1» → «Партнёрские продажи без ручного ввода». Заголовок слайда."
        },
        "streams": {
          "type": "object",
          "additionalProperties": {
            "$ref": "#/definitions/stream"
          },
          "description": "Ключ эпика → строка-направление на слайде: цель и KR, сводка спринта (done/next/blocker), Sprint Goal. Ключ «no-epic» — строка «Вне эпиков» (истории спринта без эпика), для неё только done/next/blocker."
        },
        "rows": {
          "type": "object",
          "additionalProperties": {
            "$ref": "#/definitions/row"
          },
          "description": "Ключ истории спринта → её текст: что сделано, след. шаг, блокер. На слайде строка — эпик, истории — в сайдбаре по клику; блокер истории виден на слайде команды («Заблокированы») и в сводке эпика."
        },
        "changes": {
          "type": "array",
          "maxItems": 4,
          "items": {
            "$ref": "#/definitions/change"
          },
          "description": "Устарело: слайд «Изменения в процессе спринта» убран из колоды (2026-10). Поле принимается, на страницу не выводится."
        },
        "demo": {
          "type": "array",
          "maxItems": 6,
          "items": {
            "$ref": "#/definitions/demo"
          },
          "description": "Устарело: слайд «Демо» убран из колоды (2026-10). Поле принимается, на страницу не выводится."
        },
        "risks": {
          "type": "array",
          "maxItems": 4,
          "items": {
            "$ref": "#/definitions/risk"
          },
          "description": "Квартальные риски: срыв коммитментов OKR и внешние зависимости."
        },
        "members": {
          "type": "array",
          "items": { "type": "string", "minLength": 1 },
          "description": "Состав команды (прямое подчинение), ФИО как в JIRA — из кэша целей (PO-агент команды). Остальные исполнители на доске — [EXT] на операционном слайде."
        },
        "escalation": {
          "type": "string",
          "minLength": 2,
          "description": "Кто по умолчанию эскалирует блокеры команды (сайдбар «блокаторы»), до 60 знаков. Нет — «PO команды»."
        },
        "hide": {
          "type": "array",
          "items": { "type": "string", "pattern": "^[A-Z][A-Z0-9_]*-\\d+$" },
          "description": "Ключи задач спринта, которые PO убрал из отчёта (закрыты по решению PO, служебные). Не видны на слайдах и не считаются в итогах."
        },
        "goalsSource": {
          "type": "string",
          "minLength": 3,
          "description": "Откуда цели и коммитменты: файл OKR/roadmap или «со слов PO, дата»."
        },
        "roadmap": {
          "type": "object",
          "required": ["rows"],
          "additionalProperties": false,
          "description": "Слайд «Инициативы по спринтам»: квартальный план команды на 3 следующих спринта, по 2 недели (6 ячеек). Строка — инициатива: эпик команды (epic) или своя строка (title, obj); cells — фаза в каждой неделе или пусто. Порядок строк — как в блоке. Нет блока — каркас из данных (открытые эпики, полоса до срока или прогноза).",
          "properties": {
            "rows": {
              "type": "array",
              "maxItems": 14,
              "items": { "$ref": "#/definitions/roadmapRow" }
            }
          }
        },
        "plans": {
          "type": "object",
          "additionalProperties": false,
          "description": "Устарело: слайд «Планы на следующий спринт» заменён роадмапом (2026-10). Поле принимается; колонка escalate показывается в «Риски и проблемы», если risks не заданы. Прежнее описание: слайд «Планы на следующий спринт»: четыре колонки, внутри — по направлениям (эпик берётся по первому ключу карточки), до 30 строк в колонке (на слайде — около 15 строк, остальное «ещё N» в подсказке). Нет колонки — страница возьмёт её из данных (следующие задачи эпиков, незакрытое в спринте, низкий приоритет, заблокированное).",
          "properties": {
            "take": {
              "type": "array",
              "maxItems": 30,
              "items": {
                "$ref": "#/definitions/planCard"
              },
              "description": "Взять в работу: что команда берёт в следующий спринт."
            },
            "finish": {
              "type": "array",
              "maxItems": 30,
              "items": {
                "$ref": "#/definitions/planCard"
              },
              "description": "Доделать: что переносится из этого спринта."
            },
            "maybe": {
              "type": "array",
              "maxItems": 30,
              "items": {
                "$ref": "#/definitions/planCard"
              },
              "description": "Возможно войдёт: задачи низкого приоритета — берём, если появится окно."
            },
            "escalate": {
              "type": "array",
              "maxItems": 30,
              "items": {
                "$ref": "#/definitions/planCard"
              },
              "description": "Эскалировать: где нужна помощь руководства или смежников."
            }
          }
        }
      },
      "required": [
        "dataHash"
      ]
    },
    "stream": {
      "type": "object",
      "additionalProperties": false,
      "properties": {
        "obj": {
          "type": "string",
          "pattern": "^OBJ \\S+$",
          "description": "Код цели: «OBJ 1». Эпики одной цели — на одном слайде."
        },
        "kr": {
          "type": "string",
          "minLength": 3,
          "description": "KR, которым служит эпик: «KR 1.1 — заказы от партнёров без ручного ввода», до 120 знаков. Только из OKR/roadmap PO."
        },
        "promise": {
          "type": "string",
          "minLength": 5,
          "description": "Что обещали на спринт, до 160 знаков."
        },
        "shown": {
          "type": "string",
          "minLength": 5,
          "description": "Что показываем по факту, до 160 знаков."
        },
        "verdict": {
          "enum": [
            "достигнут",
            "достигнут частично",
            "не достигнут"
          ],
          "description": "Sprint Goal по KR."
        },
        "readiness": {
          "type": "integer",
          "minimum": 0,
          "maximum": 100,
          "description": "Готовность направления по оценке PO, %: главная цифра в «Результате» (с пометкой «оценка PO»), расчёт по задачам спринта — в подсказке. Только со слов PO."
        },
        "done": {
          "type": "string",
          "minLength": 5,
          "description": "Итог спринта по направлению — одно предложение для бизнеса, сводка историй, до 180 знаков. Заменяет автоматическое «Закрыто: …»."
        },
        "next": {
          "type": "string",
          "minLength": 5,
          "description": "Следующий шаг по направлению: действие и срок, до 100 знаков."
        },
        "blocker": {
          "type": "string",
          "minLength": 5,
          "description": "В чём заблокированы по направлению и кто нужен, до 140 знаков."
        }
      }
    },
    "row": {
      "type": "object",
      "additionalProperties": false,
      "properties": {
        "done": {
          "type": "string",
          "minLength": 5,
          "description": "Что сделано — одно предложение для бизнеса, до 140 знаков."
        },
        "next": {
          "type": "string",
          "minLength": 5,
          "description": "Следующий шаг: действие и срок, до 100 знаков."
        },
        "blocker": {
          "type": "string",
          "minLength": 5,
          "description": "Что блокирует и кто, до 120 знаков."
        },
        "escalate": {
          "type": "string",
          "minLength": 2,
          "description": "Кто эскалирует этот блокер, до 60 знаков (по умолчанию — escalation команды)."
        }
      }
    },
    "change": {
      "type": "object",
      "required": [
        "affected",
        "before",
        "after"
      ],
      "additionalProperties": false,
      "properties": {
        "affected": {
          "type": "string",
          "minLength": 3,
          "description": "Что затронуто: задача или стрим, до 80 знаков."
        },
        "before": {
          "type": "string",
          "minLength": 3,
          "description": "Было, до 120 знаков."
        },
        "after": {
          "type": "string",
          "minLength": 3,
          "description": "Стало, до 120 знаков."
        },
        "outcome": {
          "type": "string",
          "minLength": 5,
          "description": "Что из этого вышло, до 200 знаков."
        }
      }
    },
    "demo": {
      "type": "object",
      "required": [
        "what"
      ],
      "additionalProperties": false,
      "properties": {
        "what": {
          "type": "string",
          "minLength": 5,
          "description": "Что показываем, до 120 знаков."
        },
        "minutes": {
          "type": "integer",
          "minimum": 1,
          "maximum": 30
        }
      }
    },
    "roadmapRow": {
      "type": "object",
      "required": ["cells"],
      "additionalProperties": false,
      "properties": {
        "epic": { "type": "string", "pattern": "^[A-Z][A-Z0-9_]*-\\d+$", "description": "Ключ эпика команды из снимка: название, номер цели и срок страница возьмёт сама." },
        "title": { "type": "string", "minLength": 3, "description": "Название инициативы для бизнеса, до 80 знаков. Без epic — обязательно." },
        "obj": { "type": "string", "pattern": "^OBJ \\d+$", "description": "Цель квартала для строки без эпика: «OBJ 2» → номер 02." },
        "cells": {
          "type": "array",
          "maxItems": 6,
          "items": { "enum": ["", "аналитика", "дизайн", "бек", "фронт", "разработка", "qa", "приёмка", "релиз", "контент"] },
          "description": "Фаза по неделям: спринт 1 — ячейки 1–2, спринт 2 — 3–4, спринт 3 — 5–6; пусто — работ нет."
        }
      }
    },
    "risk": {
      "type": "object",
      "required": [
        "title",
        "text"
      ],
      "additionalProperties": false,
      "properties": {
        "kind": { "enum": ["external", "resource", "general", "deadline"], "description": "Метка на слайде «Риски и проблемы»: Внешнее (ждём другие команды), Ресурс, Общее, Срок. Нет — «Общее»." },
        "title": {
          "type": "string",
          "minLength": 5,
          "description": "Суть риска, до 80 знаков."
        },
        "text": {
          "type": "string",
          "minLength": 10,
          "description": "Что под угрозой (коммитмент OKR, дата) и почему, до 280 знаков."
        }
      }
    },
    "planCard": {
      "type": "object",
      "required": [
        "title"
      ],
      "additionalProperties": false,
      "properties": {
        "title": {
          "type": "string",
          "minLength": 3,
          "description": "Суть карточки, до 80 знаков."
        },
        "text": {
          "type": "string",
          "description": "Одно предложение: зачем, что мешает или кто нужен, до 160 знаков."
        },
        "keys": {
          "type": "array",
          "items": {
            "type": "string",
            "pattern": "^[A-Z][A-Z0-9_]*-\\d+$"
          }
        }
      }
    }
  }
}
