{
 "version": 1,
 "generatedAt": "2026-09-15T17:20:00+03:00",
 "author": "PO-агент (пример)",
 "teams": {
  "platform": {
   "dataHash": "0000000000000000000000000000000000000000000000000000000000000000",
   "objectives": {
    "OBJ 1": "Партнёрские заказы без ручного ввода",
    "OBJ 2": "Единый каталог во всех каналах",
    "OBJ 3": "Платформа держит пиковый сезон"
   },
   "streams": {
    "INIT-101": {
     "promise": "Переезд приёма заказов на новое хранилище",
     "shown": "Переезд в работе, метрики загрузчика ещё в дизайне",
     "verdict": "не достигнут",
     "obj": "OBJ 1",
     "kr": "KR 1.1 — заказы от партнёров без ручного ввода"
    },
    "INIT-111": {
     "promise": "Агрегация каталога и автотесты интеграции",
     "shown": "Агрегация готова и ждёт проверки, автотесты не начаты",
     "verdict": "достигнут частично",
     "obj": "OBJ 2",
     "kr": "KR 2.1 — единая карточка товара во всех каналах",
     "readiness": 80
    },
    "INIT-119": {
     "obj": "OBJ 3",
     "kr": "KR 3.2 — инциденты находим раньше клиентов"
    },
    "INIT-125": {
     "promise": "Сервис приёма событий и метрики загрузчика на новом хранилище",
     "shown": "Метрики загрузчика на ревью, сервис приёма событий стоит",
     "verdict": "достигнут частично",
     "obj": "OBJ 3",
     "kr": "KR 3.1 — платформа выдерживает пиковый сезон",
     "done": "Метрики загрузчика собраны и на ревью; сервис приёма событий поднят на стенде, но приём не включён.",
     "blocker": "нет доступа к очереди событий смежной команды",
     "next": "эскалация на синке команд в четверг"
    },
    "INIT-140": {
     "obj": "OBJ 1",
     "kr": "KR 1.3 — партнёры подключаются по стандартному API"
    }
   },
   "rows": {
    "INIT-132": {
     "done": "Сервис приёма событий поднят на стенде, приём ещё не включён.",
     "blocker": "нет доступа к очереди событий смежной команды",
     "next": "эскалация на синке команд в четверг",
     "escalate": "Руководитель смежной команды"
    },
    "INIT-136": {
     "done": "Метрики загрузчика собраны, дашборд на ревью.",
     "next": "закрыть ревью и выкатить до конца спринта"
    },
    "INIT-112": {
     "done": "Агрегация каталога собрана и ждёт приёмки PO.",
     "next": "приёмка PO на этой неделе"
    },
    "INIT-102": {
     "done": "Переезд на новое хранилище начат: схема данных согласована.",
     "next": "перенести запись заказов"
    }
   },
   "risks": [
    {
     "title": "Пиковый сезон",
     "text": "По OKR — коммитмент: платформа выдерживает пиковый сезон к концу квартала. Миграция хранилища идёт с отставанием, раскатка может сдвинуться на следующий квартал.",
     "kind": "deadline"
    },
    {
     "kind": "resource",
     "title": "Аналитики платформы перегружены",
     "text": "Два больших эпика в аналитике одновременно: возможно, усилим аналитиков разработчиками."
    }
   ],
   "goalsSource": ".okr/2026Q3/OKR-2026Q3.md (пример)",
   "plans": {
    "take": [
     {
      "title": "Импорт остатков по расписанию",
      "text": "Следующий шаг KR 1.1: партнёрские остатки без ручной выгрузки.",
      "keys": [
       "INIT-7028"
      ]
     }
    ],
    "finish": [
     {
      "title": "Метрики загрузчика",
      "text": "Закрыть ревью и выкатить дашборд в первые дни спринта.",
      "keys": [
       "INIT-136"
      ]
     },
     {
      "title": "Сервис приёма событий",
      "text": "Включить приём на стенде, как только откроют доступ к очереди.",
      "keys": [
       "INIT-132"
      ]
     }
    ],
    "maybe": [
     {
      "title": "Отчёт по импорту для партнёров",
      "text": "Низкий приоритет: возьмём, если останется окно после импорта остатков.",
      "keys": [
       "INIT-7031"
      ]
     }
    ],
    "escalate": [
     {
      "title": "Доступ к очереди событий смежной команды",
      "text": "Без доступа KR 1.1 сдвигается; нужен владелец и дата со стороны смежников.",
      "keys": [
       "INIT-132"
      ]
     }
    ]
   },
   "members": [
    "Участник Б",
    "Участник В",
    "Участник Г",
    "Участник Д",
    "Участник Ж",
    "Участник З"
   ],
   "escalation": "PO Платформы",
   "roadmap": {
    "rows": [
     {
      "epic": "INIT-101",
      "cells": [
       "бек",
       "бек",
       "бек",
       "qa",
       "приёмка",
       ""
      ]
     },
     {
      "epic": "INIT-125",
      "cells": [
       "аналитика",
       "аналитика",
       "бек",
       "бек",
       "бек",
       "приёмка"
      ]
     },
     {
      "epic": "INIT-111",
      "cells": [
       "",
       "qa",
       "qa",
       "приёмка",
       "",
       ""
      ]
     },
     {
      "title": "Подготовка к пиковому сезону: нагрузочные тесты",
      "obj": "OBJ 3",
      "cells": [
       "",
       "",
       "qa",
       "qa",
       "qa",
       "приёмка"
      ]
     }
    ]
   }
  },
  "catalog": {
   "dataHash": "0000000000000000000000000000000000000000000000000000000000000000",
   "objectives": {
    "OBJ 2": "Единый каталог во всех каналах",
    "OBJ 3": "Платформа держит пиковый сезон"
   },
   "streams": {
    "INIT-208": {
     "promise": "Мониторинг поиска и фича-флаги релиза",
     "shown": "Мониторинг в проде, фича-флаги на проверке",
     "verdict": "достигнут частично",
     "obj": "OBJ 2",
     "kr": "KR 2.2 — конверсия поиска в корзину"
    },
    "INIT-219": {
     "promise": "Очередь модерации и приём событий остатков",
     "shown": "Очередь в работе, приём событий заблокирован",
     "verdict": "не достигнут",
     "obj": "OBJ 2",
     "kr": "KR 2.3 — актуальные остатки на витрине"
    },
    "INIT-227": {
     "obj": "OBJ 3",
     "kr": "KR 3.1 — платформа выдерживает пиковый сезон"
    }
   },
   "rows": {
    "INIT-216": {
     "done": "Мониторинг поиска в проде, алерты заведены."
    },
    "INIT-225": {
     "done": "Обработчик событий остатков готов.",
     "blocker": "партнёр не выдал доступ к очереди событий",
     "next": "запросить доступ через менеджера партнёра"
    }
   },
   "risks": [
    {
     "title": "Актуальные остатки на витрине",
     "text": "По OKR — коммитмент на конец квартала. Импорт остатков стоит на доступе к событиям партнёра: раскатка сдвигается."
    }
   ],
   "goalsSource": ".okr/2026Q3/OKR-2026Q3.md (пример)"
  }
 },
 "jiraNative": "https://jira-native.example/jira/?key={key}"
}
